{"$schema":"https://json-schema.org/draft/2020-12/schema","title":"Screen universe","type":"object","required":["id","name","shortName","color","description","continuityType"],"properties":{"id":{"type":"string"},"name":{"type":"string"},"shortName":{"type":"string"},"color":{"type":"string"},"description":{"type":"string"},"parentUniverseId":{"type":"string"},"continuityType":{"enum":["primary","branch","reboot","adjacent"]}}}
